{
  "$schema": "http://json-schema.org/draft-07/schema#",
  "title": "Language cheat deck",
  "description": "One (target language × audience language) cheatsheet. Rendered by tools/build_pages.py into a static page; the header language menu comes from the sibling site.json registry. _note / _readme fields carry provenance and are ignored.",
  "type": "object",
  "required": ["meta", "strings", "views", "sections", "details"],
  "additionalProperties": false,
  "properties": {
    "_readme": {"type": "string"},
    "meta": {
      "type": "object",
      "required": ["deck", "target", "audience", "target_lang", "lang", "out", "site_base", "site_path", "brand_mark", "brand_name", "brand_sub", "apple_title", "title", "description", "og_title", "og_description", "plan_path"],
      "additionalProperties": false,
      "properties": {
        "deck": {"type": "string", "pattern": "^[a-z]{2}-[a-z]{2}$"},
        "target": {"type": "string", "pattern": "^[a-z]{2}$"},
        "audience": {"type": "string", "pattern": "^[a-z]{2}$"},
        "target_lang": {"type": "string", "pattern": "^[a-z]{2}$"},
        "lang": {"type": "string", "pattern": "^[a-z]{2}$", "description": "UI/explanation language of the page (<html lang>)"},
        "out": {"type": "string"},
        "site_base": {"type": "string", "format": "uri"},
        "site_path": {"type": "string", "description": "URL path of the page relative to site_base, e.g. de/ru/ — its depth drives the ../../ prefix for root assets"},
        "brand_mark": {"type": "string"},
        "brand_name": {"type": "string"},
        "brand_sub": {"type": "string"},
        "apple_title": {"type": "string"},
        "title": {"type": "string"},
        "description": {"type": "string"},
        "og_title": {"type": "string"},
        "og_description": {"type": "string"},
        "plan_path": {"type": "string"}
      }
    },
    "strings": {"$ref": "#/definitions/strings"},
    "help": {
      "type": "object",
      "required": ["id", "ico", "label", "detail"],
      "additionalProperties": false,
      "properties": {
        "id": {"type": "string"},
        "ico": {"type": "string"},
        "label": {"type": "string"},
        "detail": {"type": "string"}
      }
    },
    "views": {
      "type": "array", "minItems": 3, "maxItems": 5,
      "items": {
        "type": "object", "required": ["id", "ico", "label"],
        "additionalProperties": false,
        "properties": {"id": {"type": "string"}, "ico": {"type": "string"}, "label": {"type": "string"}}
      }
    },
    "sections": {"type": "array", "items": {"$ref": "#/definitions/section"}},
    "details": {
      "type": "object",
      "minProperties": 1,
      "additionalProperties": {"$ref": "#/definitions/detailEntry"}
    }
  },
  "definitions": {
    "runs": {
      "type": "array",
      "items": {"$ref": "#/definitions/run"}
    },
    "run": {
      "oneOf": [
        {"type": "string", "minLength": 1},
        {
          "type": "object",
          "additionalProperties": false,
          "properties": {
            "t": {"type": "string"},
            "b": {"type": "boolean"},
            "i": {"type": "boolean"},
            "s": {"type": "boolean"},
            "hit": {"type": "boolean", "description": "bold + .hit highlight: the form this card teaches"},
            "br": {"type": "boolean"}
          },
          "anyOf": [{"required": ["t"]}, {"required": ["br"]}]
        }
      ]
    },
    "block": {
      "oneOf": [
        {"type": "object", "required": ["h"], "additionalProperties": false, "properties": {"h": {"$ref": "#/definitions/runs"}}},
        {"type": "object", "required": ["p"], "additionalProperties": false, "properties": {"p": {"$ref": "#/definitions/runs"}}},
        {"type": "object", "required": ["tiny"], "additionalProperties": false, "properties": {"tiny": {"$ref": "#/definitions/runs"}}},
        {
          "type": "object", "required": ["example"], "additionalProperties": false,
          "properties": {
            "example": {"$ref": "#/definitions/runs"},
            "gloss": {"$ref": "#/definitions/runs", "description": "audience-language translation with optional deciding hint; renders the pair layout (.example.pair)"}
          }
        },
        {
          "type": "object", "required": ["formula"], "additionalProperties": false,
          "properties": {
            "formula": {
              "type": "array", "minItems": 1,
              "items": {
                "oneOf": [
                  {
                    "type": "object", "required": ["slot"], "additionalProperties": false,
                    "properties": {"slot": {"$ref": "#/definitions/runsOrString"}, "role": {"enum": ["verb", "end", "sub"]}}
                  },
                  {"type": "object", "required": ["arrow"], "additionalProperties": false, "properties": {"arrow": {"type": "string"}}}
                ]
              }
            }
          }
        },
        {
          "type": "object", "required": ["table"], "additionalProperties": false,
          "properties": {
            "table": {
              "type": "object", "required": ["head", "rows"],
              "additionalProperties": false,
              "properties": {
                "head": {"type": "array", "minItems": 1, "items": {"type": "string"}},
                "rows": {
                  "type": "array", "minItems": 1,
                  "items": {"type": "array", "items": {"$ref": "#/definitions/cell"}}
                }
              }
            }
          }
        },
        {
          "type": "object", "required": ["chips"], "additionalProperties": false,
          "properties": {
            "chips": {
              "type": "array", "minItems": 1,
              "items": {
                "type": "object", "required": ["label", "detail"],
                "additionalProperties": false,
                "properties": {
                  "label": {"$ref": "#/definitions/runsOrString"},
                  "detail": {"type": "string"},
                  "neutral": {"type": "boolean"}
                }
              }
            }
          }
        },
        {
          "type": "object", "required": ["legend"], "additionalProperties": false,
          "description": "static term inventory one dialog explains (not tappable); detail+label are all-or-nothing and render the single entry button — a card may open each dialog at most once (enforced by the build)",
          "properties": {
            "legend": {
              "type": "object", "required": ["items"],
              "additionalProperties": false,
              "allOf": [
                {"if": {"required": ["detail"]}, "then": {"required": ["label"]}},
                {"if": {"required": ["label"]}, "then": {"required": ["detail"]}}
              ],
              "properties": {
                "layout": {"enum": ["inline", "list"], "description": "inline wraps whole term/meaning groups; list places one entry per row"},
                "items": {
                  "type": "array", "minItems": 1,
                  "items": {
                    "oneOf": [
                      {"type": "string", "minLength": 1},
                      {"$ref": "#/definitions/runs"},
                      {
                        "type": "object", "required": ["term"],
                        "additionalProperties": false,
                        "properties": {
                          "term": {"oneOf": [{"type": "string", "minLength": 1}, {"$ref": "#/definitions/runs"}]},
                          "meaning": {"type": "string", "minLength": 1}
                        }
                      }
                    ]
                  }
                },
                "detail": {"type": "string"},
                "label": {"type": "string", "minLength": 1}
              }
            }
          }
        },
        {
          "type": "object", "required": ["notice"], "additionalProperties": false,
          "properties": {
            "notice": {"$ref": "#/definitions/runs"},
            "warning": {"type": "boolean"}
          }
        },
        {
          "type": "object", "required": ["detail"], "additionalProperties": false,
          "properties": {
            "detail": {
              "type": "object", "required": ["label", "runs"],
              "additionalProperties": false,
              "properties": {"label": {"type": "string"}, "runs": {"$ref": "#/definitions/runs"}, "comment": {"$ref": "#/definitions/runs"}}
            }
          }
        }
      ]
    },
    "cell": {
      "oneOf": [
        {"type": "string"},
        {"type": "object", "required": ["hot"], "additionalProperties": false, "properties": {"hot": {"type": "string"}}}
      ]
    },
    "runsOrString": {
      "oneOf": [{"type": "string"}, {"$ref": "#/definitions/runs"}]
    },
    "card": {
      "type": "object",
      "required": ["search", "id"],
      "additionalProperties": false,
      "properties": {
        "search": {"type": "string"},
        "id": {"type": "string", "pattern": "^[a-z0-9](?:[a-z0-9-]{0,30}[a-z0-9])$", "description": "anchor slug; the page anchor is <section-id>-<slug> — stable, renaming breaks shared links"},
        "_note": {"type": "string"},
        "level": {"enum": ["A1", "A2", "B1"], "description": "optional badge: CEFR level of the topic"},
        "kind": {"type": "string", "minLength": 1, "maxLength": 40, "description": "optional badge: what the card gives you (recommended vocabulary: формы / употребление / порядок / время / связь / триггер → падеж)"},
        "blocks": {"type": "array", "minItems": 1, "items": {"$ref": "#/definitions/block"}},
        "case_grid": {
          "type": "array", "minItems": 1,
          "description": "Renders the card as div.case-grid.cheat-card of tappable case buttons",
          "items": {
            "type": "object", "required": ["detail", "label"],
            "additionalProperties": false,
            "properties": {"detail": {"type": "string"}, "label": {"$ref": "#/definitions/runs"}}
          }
        }
      },
      "oneOf": [{"required": ["blocks"]}, {"required": ["case_grid"]}]
    },
    "group": {
      "type": "object",
      "required": ["cards"],
      "additionalProperties": false,
      "properties": {
        "cards": {"type": "array", "minItems": 1, "items": {"$ref": "#/definitions/card"}},
        "grid": {"enum": ["two", "three", null]},
        "gap": {"type": "boolean", "description": "adds margin-top:10px to the gridded group (build validator: requires grid)"}
      }
    },
    "section": {
      "type": "object",
      "required": ["id", "view", "heading", "sub"],
      "additionalProperties": false,
      "properties": {
        "id": {"type": "string"},
        "view": {"type": "string"},
        "badge": {"type": "string"},
        "heading": {"type": "string"},
        "sub": {"type": "string"},
        "_note": {"type": "string"},
        "grid": {"enum": ["two", "three", null]},
        "cards": {"type": "array", "minItems": 1, "items": {"$ref": "#/definitions/card"}},
        "groups": {"type": "array", "minItems": 1, "items": {"$ref": "#/definitions/group"}}
      },
      "oneOf": [{"required": ["cards"]}, {"required": ["groups"]}]
    },
    "detailEntry": {
      "type": "object",
      "required": ["title", "lead", "blocks"],
      "additionalProperties": false,
      "properties": {
        "title": {"type": "string"},
        "lead": {"type": "string"},
        "blocks": {"type": "array", "minItems": 1, "items": {"$ref": "#/definitions/block"}}
      }
    },
    "strings": {
      "type": "object",
      "required": ["search_placeholder", "search_aria", "clear_aria", "search_results", "install_label", "close_aria", "nav_aria", "no_results", "noscript_notice", "noscript_intro", "theme", "install_ios", "install_generic", "footer_all", "footer_install", "footer_plan", "menu_aria", "nudge_text"],
      "additionalProperties": false,
      "properties": {
        "_note": {"type": "string"},
        "search_placeholder": {"type": "string"},
        "search_aria": {"type": "string"},
        "clear_aria": {"type": "string"},
        "search_results": {"type": "string"},
        "install_label": {"type": "string"},
        "close_aria": {"type": "string"},
        "nav_aria": {"type": "string"},
        "no_results": {"type": "string"},
        "noscript_notice": {"type": "string"},
        "noscript_intro": {"$ref": "#/definitions/runs"},
        "theme": {
          "type": "object", "required": ["auto", "light", "dark"],
          "additionalProperties": false,
          "properties": {
            "auto": {"$ref": "#/definitions/themeMode"},
            "light": {"$ref": "#/definitions/themeMode"},
            "dark": {"$ref": "#/definitions/themeMode"}
          }
        },
        "install_ios": {"$ref": "#/definitions/installDialog"},
        "install_generic": {"$ref": "#/definitions/installDialog"},
        "footer_all": {"type": "string"},
        "footer_install": {"type": "string"},
        "footer_plan": {"type": "string"},
        "lang_menu_aria": {"type": "string", "description": "header language menu — summary aria-label"},
        "menu_aria": {"type": "string", "description": "mobile burger summary aria-label"},
        "nudge_text": {"type": "string", "description": "one-time install nudge text"},
        "lang_group_target": {"type": "string", "description": "menu group header: learning language"},
        "lang_group_audience": {"type": "string", "description": "menu group header: explanation language"},
        "skin_group": {"type": "string", "description": "menu group header: skin/design"},
        "skin_classic": {"type": "string", "description": "skin option: classic"},
        "skin_a": {"type": "string", "description": "skin option: alternative (notebook)"},
        "lang_soon": {"type": "string", "description": "marker for audiences without a deck yet"}
      }
    },
    "themeMode": {
      "type": "object", "required": ["icon", "label"],
      "additionalProperties": false,
      "properties": {"icon": {"type": "string"}, "label": {"type": "string"}}
    },
    "installDialog": {
      "type": "object", "required": ["title", "lead", "blocks"],
      "additionalProperties": false,
      "properties": {
        "title": {"type": "string"},
        "lead": {"type": "string"},
        "blocks": {
          "type": "array", "minItems": 1,
          "items": {
            "type": "object", "required": ["label", "runs"],
            "additionalProperties": false,
            "properties": {"label": {"type": "string"}, "runs": {"$ref": "#/definitions/runs"}, "comment": {"$ref": "#/definitions/runs"}}
          }
        }
      }
    }
  }
}
