{
  "_readme": "German cheat deck for English speakers. Rendered by tools/build_pages.py into de/en/index.html — edit this file, then regenerate (see AGENTS.md). Schema: schema.json. _note fields carry review provenance and are ignored by the generator. Scaffolded 2026-09-28 as a text copy of de-ru.json (audience-variant Phase 1b): meta, strings, help, views and practice re-derived for English speakers; sections and card-facing DETAILS entries spliced from the frags-de-en-*.fragment author groups (audience-variant Phase 1d).",
  "meta": {
    "deck": "de-en",
    "target": "de",
    "audience": "en",
    "target_lang": "de",
    "lang": "en",
    "out": "de/en/index.html",
    "site_base": "https://andkirby.github.io/learn-language-cheat-sheet/",
    "site_path": "de/en/",
    "brand_mark": "DE",
    "brand_name": "German Cheat",
    "brand_sub": "EN → DE · A1–B1",
    "apple_title": "DE Cheat",
    "title": "German Grammar Cheatsheet",
    "description": "Mobile German grammar cheat sheet: cases, articles, word order, subordinate clauses and verb constructions.",
    "og_title": "German Grammar Cheatsheet",
    "og_description": "German grammar without paging through a textbook: cases, articles, word order, clauses. A1–B1, offline.",
    "plan_path": "de/en/SITE_PLAN.md"
  },
  "strings": {
    "search_placeholder": "Search: wem, weil, modal, Dativ…",
    "search_aria": "Search the German cheat sheet",
    "clear_aria": "Clear search",
    "search_results": "Cards found",
    "install_label": "Install",
    "close_aria": "Close",
    "nav_aria": "Main navigation",
    "no_results": "Nothing found. Try “wem”, “modal”, “weil”, “Dativ”, “Perfekt”.",
    "noscript_notice": "Search, details and app install need JavaScript. All cheat-sheet content below works without it.",
    "noscript_intro": [
      "Look at the ",
      {"t": "trigger", "b": true},
      " — case, preposition, conjunction or verb construction — then at the form and the position."
    ],
    "theme": {
      "auto": {"icon": "◐", "label": "Theme: system"},
      "light": {"icon": "☀", "label": "Theme: light"},
      "dark": {"icon": "☾", "label": "Theme: dark"}
    },
    "install_ios": {
      "title": "Install on iPhone",
      "lead": "Safari doesn’t show the standard install prompt.",
      "blocks": [
        {"label": "1.", "runs": ["Open the Share menu."]},
        {"label": "2.", "runs": ["Choose Add to Home Screen."]},
        {"label": "3.", "runs": ["Confirm with Add."]}
      ]
    },
    "install_generic": {
      "title": "Install on your phone",
      "lead": "This is a PWA: after the first load it works offline too.",
      "blocks": [
        {"label": "Android / Chrome", "runs": ["Browser menu → Install app / Add to Home screen."]},
        {"label": "iPhone / Safari", "runs": ["Share → Add to Home Screen."]},
        {"label": "Important", "runs": ["Install and offline caching need the page opened over HTTPS (or localhost), not as a local file from the Files app."]}
      ]
    },
    "footer_all": "all cheat sheets",
    "footer_install": "Install: page menu (☰) → “Install” · iPhone — Share → Add to Home Screen",
    "footer_plan": "content plan:",
    "menu_aria": "Menu: language, design, help, install",
    "nudge_text": "Work offline — install the cheat sheet on your phone",
    "lang_menu_aria": "Learning language, explanation language and design",
    "lang_group_target": "Learning language",
    "lang_group_audience": "Explanation language",
    "skin_group": "Design",
    "skin_classic": "Classic",
    "skin_a": "Notebook",
    "lang_soon": "soon"
  },
  "help": {
    "id": "start",
    "ico": "i",
    "label": "How to use",
    "detail": "lookup-help"
  },
  "views": [
    {"id": "cases", "ico": "A/D", "label": "Cases"},
    {"id": "forms", "ico": "der", "label": "Forms"},
    {"id": "order", "ico": "V2", "label": "Order"},
    {"id": "clauses", "ico": "weil", "label": "Clauses"}
  ],
  "sections": [
    {
      "id": "cases",
      "view": "cases",
      "badge": "4 Fälle",
      "heading": "Cases",
      "sub": "Question → role → form.",
      "groups": [
        {
          "cards": [
            {
              "id": "faelle",
              "search": "fälle cases nominativ akkusativ dativ genitiv wer wen wem wessen was",
              "case_grid": [
                {"detail": "nominativ", "label": [{"t": "Nominativ", "b": true}, {"br": true}, "Wer? Was?", " — who? what?"]},
                {"detail": "akkusativ", "label": [{"t": "Akkusativ", "b": true}, {"br": true}, "Wen? Was?", " — whom? what?"]},
                {"detail": "dativ", "label": [{"t": "Dativ", "b": true}, {"br": true}, "Wem?", " — to whom?"]},
                {"detail": "genitiv", "label": [{"t": "Genitiv", "b": true}, {"br": true}, "Wessen?", " — whose?"]}
              ]
            }
          ]
        },
        {
          "grid": "two",
          "gap": true,
          "cards": [
            {
              "id": "wo-wohin",
              "level": "A1",
              "kind": "trigger → case",
              "search": "wo wohin wechselpräpositionen movement location direction into position akkusativ dativ",
              "blocks": [
                {"h": ["Wo? / Wohin?"]},
                {"p": [{"t": "Wo?", "b": true}, " — where? (position, like English ", {"t": "in the house", "i": true}, ") → usually ", {"t": "Dativ", "b": true}, " with ", {"t": "Wechselpräpositionen", "b": true}, "."]},
                {"p": [{"t": "Wohin?", "b": true}, " — where to? (direction, like English ", {"t": "into the house", "i": true}, ") → usually ", {"t": "Akkusativ", "b": true}, "."]},
                {"example": [{"t": "Ich bin in der Schule (Wo?).", "b": true}, {"br": true}, {"t": "Ich gehe in die Schule (Wohin?).", "b": true}], "gloss": ["I am at school (where?).", {"br": true}, "I am going to school (where to?)."]},
                {"chips": [{"label": "When does this rule apply?", "detail": "wo-wohin"}]}
              ]
            },
            {
              "id": "objects",
              "level": "A1",
              "kind": "usage",
              "search": "direct indirect object receiver akkusativ dativ geben whom give",
              "blocks": [
                {"h": ["The quick meaning"]},
                {"p": [{"t": "Akk.", "b": true}, " mostly = the direct object: ", {"t": "I see — whom?", "i": true}]},
                {"p": [{"t": "Dat.", "b": true}, " mostly = the receiver: ", {"t": "I give — to whom?", "i": true}]},
                {"example": [
                  "Ich gebe ", {"t": "dem Mann", "hit": true}, " ", {"t": "das Buch", "hit": true}, "."
                ], "gloss": ["I give the man the book. dem Mann — receiver (Dat.); das Buch — direct object (Akk.)."]},
                {"chips": [{"label": "Two objects", "detail": "objects"}]}
              ]
            }
          ]
        }
      ]
    },
    {
      "id": "forms",
      "view": "forms",
      "badge": "Formen",
      "heading": "Articles and pronouns",
      "sub": "The main forms that actually change.",
      "groups": [
        {
          "cards": [
            {
              "id": "artikel",
              "level": "A1",
              "kind": "forms",
              "search": "the der die das den dem des definite article artikel case",
              "blocks": [
                {"h": ["Definite article — ", {"t": "der / die / das", "b": true}]},
                {"table": {
                  "head": ["", "Mask.", "Neut.", "Fem.", "Plural"],
                  "rows": [
                    ["Nom.", "der", "das", "die", "die"],
                    ["Akk.", {"hot": "den"}, "das", "die", "die"],
                    ["Dat.", {"hot": "dem"}, {"hot": "dem"}, {"hot": "der"}, {"hot": "den"}],
                    ["Gen.", "des", "des", "der", "der"]
                  ]
                }},
                {
                  "legend": {
                    "items": [
                      {
                        "term": "der / die / das",
                        "meaning": "the (gender/case forms)"
                      }
                    ]
                  }
                },
                {
                  "example": [
                    {
                      "t": "Der Mann",
                      "b": true
                    },
                    " kommt.",
                    {
                      "br": true
                    },
                    "Ich sehe ",
                    {
                      "t": "den",
                      "b": true
                    },
                    " Mann · mit ",
                    {
                      "t": "dem",
                      "b": true
                    },
                    " Mann"
                  ],
                  "gloss": [
                    "The man is coming.",
                    {
                      "br": true
                    },
                    "I see the man · with the man. der/den/dem all mean “the”; case changes the form."
                  ]
                },
                {"tiny": ["English “the” never changes shape — German’s does: the ending is the case marker in action. Bold = the traps of this level: masculine Akkusativ and the whole Dativ column. Genitiv changes too, but A1–B1 needs it less."]},
                {"tiny": ["Gender is not logic — ", {"t": "die Brücke", "b": true}, " is not “she”: learn every noun with its article. Genitiv and Dativ plural also change the noun (", {"t": "des Mannes", "b": true}, " · ", {"t": "den Kindern", "b": true}, ") — see Endings and changes."]},
                {
                  "tiny": [
                    "Mask. — masculine; Neut. — neuter; Fem. — feminine; Plural — more than one."
                  ]
                }
              ]
            },
            {
              "id": "dieser",
              "level": "A1",
              "kind": "forms",